Date,Name,Year,Letterboxd URI,Rating,Rewatch,Review,Tags,Watched Date
2026-02-05,Rapture,1979,https://boxd.it/cZhvAD,2,,"la movida madrileña’s final, darkest horcrux. film nerds say ‘meta’ like it’s cute, this is just a guy getting ghosted by reality and choosing 8mm over sobriety. heroin, obsession, and that specific brand of european apartment where everyone looks malnourished but spiritually overqualified. cinema as a toxic situationship and the camera is the one doing drugs.",vintage postcards having panic attacks,2026-02-04
2026-02-05,Thesis,1996,https://boxd.it/cZUc7l,4,,coming-of-age but the age you cum into is realizing you’d rather watch the snuff film than stop it.,curiosity killed the cat,2026-02-05
2026-02-07,Talk to Her,2002,https://boxd.it/d0XzzH,0.5,,"tenderness without consent, framed as romance and left to rot in plain sight.",curiosity killed the cat,2026-02-06
2026-02-07,Ajab Prem Ki Ghazab Kahani,2009,https://boxd.it/d12FCd,5,Yes,"movie taste lately feels a little too pretentious and try hard to me. rewatching to remind myself what i grew up on. it’s silly, loud, emotionally obvious, and weirdly sincere about it. songs you remember by muscle memory, and jokes that shouldn’t work, but somehow do. and yes, i was a salman khan fan once, and still can’t get over his laugh memes lmao.",,2026-02-06
2026-02-08,Hamnet,2025,https://boxd.it/d1FQtf,5,,"watched this like i was trespassing on someone else’s grief. slow, hushed, and absolutely uninterested in performing sadness for you. chloé zhao shoots absence like a physical space you keep walking into. it just sits there, lets loss rot gently in the corners, and trusts you to feel it or not. nothing dramatic happens, and yet everything does. the kind of film that makes you stare at the wall after, wondering how love survives something it can’t fix.",,2026-02-07
2026-02-15,Dogfight,1991,https://boxd.it/d7U4Il,4,,"went in expecting male ego humiliation olympics.
stayed for the softest, quietest character undoing i’ve seen in a while.

it starts ugly. like actually ugly. the whole ‘bring the ugliest date’ premise made me physically recoil. you spend the first act wanting to punch every man in uniform.

then the film does something annoying  it gives him interiority. what got me wasn’t romance, but the quiet shift when mockery turns into listening.

small film. weirdly lingering. i’m still thinking about that table scene.",,2026-02-14
2026-02-20,Dinner in America,2020,https://boxd.it/dd38D3,3.5,,hot topic anarchism meets reagan era rot and somehow it’s the healthiest love story of the decade?? idk.,very midwest anarchy thrift store normcore,2026-02-19
2026-02-22,Swimming Pool,2003,https://boxd.it/dfAyD3,,Yes,Manuscript mid? girlrot by the pool until a murder materializes.,literary gaslighting,2026-02-22
2026-02-23,Train Dreams,2025,https://boxd.it/dg19FH,3,,this could’ve been a 15 second slide deck but he had to make losing his family a whole cinematic event,,2026-02-22
2026-02-25,eXistenZ,1999,https://boxd.it/dhUGph,4,Yes,"Everything is wet, penetrative, and politically confused. the way she’s serving 1940s trad wife silhouettes and a perfect red lip while the sound design is doing a world ending carry in the background is such a psychotic flex. we love a domestic nightmare that looks like a vogue spread for the apocalypse.",,2026-02-24
2026-02-26,Reprise,2006,https://boxd.it/diMuPl,3.5,,"joachim trier invents the original <b>i’m working on something big </b>guy. this is what happens when your biggest relationship is with the version of you who already has a successful substack.
ambition as fanfiction.",,2026-02-25
2026-02-28,Perfect Blue,1997,https://boxd.it/dkEkUd,4.5,,"whoever recommended i watch this as my first anime... fuck you first. my digital footprint is already a disaster and now i have to live knowing satoshi kon spent 82 minutes professionally gaslighting me. it’s giving ‘the industrial revolution and its consequences have been a disaster for the girlies who just wanted to wear ribbons and act in a procedural.’you think your stalker is scary? try being haunted by a past version of yourself that won’t stop singing j-pop while you’re trying to dissociate in a bathtub. cinematic, brutal, and made me feel like my own reflection is about to start a podcast i didn’t consent to.",,2026-02-28
